[
  {
    "id": "req-20260306-whisper-4f6c98",
    "ts": "2026-03-06T06:39:42.982Z",
    "ttl": 3600,
    "origin": {
      "channel": "system",
      "source_id": "system-whisperer"
    },
    "signal": {
      "intent": "whisper",
      "priority": 2,
      "payload": "[SYSTEM_WHISPER] Operational Intelligence:\n- Memory: 23MB used\n- Uptime: 0h 0m\n- Services: 5 services registered in PID registry.\n- Queue: 0 stimuli pending\n- Platform: darwin (Darwin 25.2.0)\nAgent resonance is stable."
    },
    "control": {
      "status": "failed",
      "feedback": "silent",
      "evidence": [
        {
          "step": "whisper_generation",
          "ts": "2026-03-06T06:39:42.982Z",
          "agent": "system-whisperer"
        },
        {
          "step": "injection_failed",
          "ts": "2026-03-06T06:51:03.254Z",
          "agent": "nexus-daemon"
        }
      ]
    }
  },
  {
    "id": "req-20260306-whisper-37e05e",
    "ts": "2026-03-06T06:40:51.636Z",
    "ttl": 3600,
    "origin": {
      "channel": "system",
      "source_id": "system-whisperer"
    },
    "signal": {
      "intent": "whisper",
      "priority": 2,
      "payload": "[SYSTEM_WHISPER] Operational Intelligence:\n- Memory: 22MB used\n- Uptime: 0h 0m\n- Services: 5 services registered in PID registry.\n- Queue: 394 stimuli pending\n- Platform: darwin (Darwin 25.2.0)\nAgent resonance is stable."
    },
    "control": {
      "status": "pending",
      "feedback": "silent",
      "evidence": [
        {
          "step": "whisper_generation",
          "ts": "2026-03-06T06:40:51.636Z",
          "agent": "system-whisperer"
        }
      ]
    }
  },
  {
    "id": "req-20260306-whisper-32adb0",
    "ts": "2026-03-06T06:41:23.007Z",
    "ttl": 3600,
    "origin": {
      "channel": "system",
      "source_id": "system-whisperer"
    },
    "signal": {
      "intent": "whisper",
      "priority": 2,
      "payload": "[SYSTEM_WHISPER] Operational Intelligence:\n- Memory: 22MB used\n- Uptime: 0h 0m\n- Services: 5 services registered in PID registry.\n- Queue: 822 stimuli pending\n- Platform: darwin (Darwin 25.2.0)\nAgent resonance is stable."
    },
    "control": {
      "status": "pending",
      "feedback": "silent",
      "evidence": [
        {
          "step": "whisper_generation",
          "ts": "2026-03-06T06:41:23.007Z",
          "agent": "system-whisperer"
        }
      ]
    }
  },
  {
    "id": "req-20260306-whisper-e3d43c",
    "ts": "2026-03-06T06:50:37.815Z",
    "ttl": 3600,
    "origin": {
      "channel": "system",
      "source_id": "system-whisperer"
    },
    "signal": {
      "intent": "whisper",
      "priority": 2,
      "payload": "[SYSTEM_WHISPER] Operational Intelligence:\n- Memory: 22MB used\n- Uptime: 0h 0m\n- Services: 4 services registered in PID registry.\n- Queue: 1265 stimuli pending\n- Platform: darwin (Darwin 25.2.0)\nAgent resonance is stable."
    },
    "control": {
      "status": "pending",
      "feedback": "silent",
      "evidence": [
        {
          "step": "whisper_generation",
          "ts": "2026-03-06T06:50:37.815Z",
          "agent": "system-whisperer"
        }
      ]
    }
  }
]